[
  {
    "id": "biblio-ba-050",
    "type": "bibliographic_source",
    "title": "The hidden AI race: Environmental costs of artificial intelligence",
    "citation": "Agarwal, S., & Chakraborti, M. (2025). The hidden AI race: Environmental costs of artificial intelligence. ACM Press.",
    "authorsText": "Agarwal, S., & Chakraborti, M.",
    "yearText": "2025",
    "owner": "COMMON",
    "profiles": [
      "PH",
      "IT",
      "AT"
    ],
    "maturityStatus": "proposed",
    "verificationStatus": "pending_primary_source",
    "sourceRecordId": "BA-050",
    "provenance": {
      "sourceTitle": "Repositorio Institucional de Bibliografía Anotada para Pensamiento Transdisciplinario, Educación y Ética de la Inteligencia Artificial V1_1",
      "migrationDate": "2026-10-05",
      "migrationMethod": "controlled_text_extraction"
    },
    "domains": [],
    "keywords": [],
    "annotations": [],
    "relations": [],
    "migrationIssues": []
  },
  {
    "id": "biblio-ba-034",
    "type": "bibliographic_source",
    "title": "Framework for information literacy for higher education",
    "citation": "Association of College and Research Libraries. (2016). Framework for information literacy for higher education. ACRL.",
    "authorsText": "Association of College and Research Libraries.",
    "yearText": "2016",
    "owner": "COMMON",
    "profiles": [
      "PH",
      "IT",
      "AT"
    ],
    "maturityStatus": "proposed",
    "verificationStatus": "pending_primary_source",
    "sourceRecordId": "BA-034",
    "provenance": {
      "sourceTitle": "Repositorio Institucional de Bibliografía Anotada para Pensamiento Transdisciplinario, Educación y Ética de la Inteligencia Artificial V1_1",
      "migrationDate": "2026-10-05",
      "migrationMethod": "controlled_text_extraction"
    },
    "domains": [],
    "keywords": [],
    "annotations": [],
    "relations": [],
    "migrationIssues": []
  },
  {
    "id": "biblio-ba-049",
    "type": "bibliographic_source",
    "title": "Toward green AI: A methodological survey of the scientific literature",
    "citation": "Barbierato, E., & Gatti, A. (2024). Toward green AI: A methodological survey of the scientific literature. IEEE Access, 12, 23989–24015.",
    "authorsText": "Barbierato, E., & Gatti, A.",
    "yearText": "2024",
    "owner": "COMMON",
    "profiles": [
      "PH",
      "IT",
      "AT"
    ],
    "maturityStatus": "proposed",
    "verificationStatus": "pending_primary_source",
    "sourceRecordId": "BA-049",
    "provenance": {
      "sourceTitle": "Repositorio Institucional de Bibliografía Anotada para Pensamiento Transdisciplinario, Educación y Ética de la Inteligencia Artificial V1_1",
      "migrationDate": "2026-10-05",
      "migrationMethod": "controlled_text_extraction"
    },
    "domains": [],
    "keywords": [],
    "annotations": [],
    "relations": [],
    "migrationIssues": []
  },
  {
    "id": "biblio-ba-040",
    "type": "bibliographic_source",
    "title": "Virtual worlds and well-being: Current research and future directions",
    "citation": "Barreda Ángeles, M., Amendola, S., Da Silva, C., Somià, T., Boucher, P., Schade, S., Meier, A., Mansfield, K., Gunschera, L., Orben, A., Turner, G., Griffiths, M., Hartmann, T., Freeman, G., Gui, X., Kou, Y., Baumgartner, S., Vuorre, M., Ohme, J., Hine, E., López Richart, J., & Belmoussi, O. (2025). Virtual worlds and well-being: Current research and future directions. Publications Office of the European Union.",
    "authorsText": "Barreda Ángeles, M., Amendola, S., Da Silva, C., Somià, T., Boucher, P., Schade, S., Meier, A., Mansfield, K., Gunschera, L., Orben, A., Turner, G., Griffiths, M., Hartmann, T., Freeman, G., Gui, X., Kou, Y., Baumgartner, S., Vuorre, M., Ohme, J., Hine, E., López Richart, J., & Belmoussi, O.",
    "yearText": "2025",
    "owner": "COMMON",
    "profiles": [
      "PH",
      "IT",
      "AT"
    ],
    "maturityStatus": "proposed",
    "verificationStatus": "pending_primary_source",
    "sourceRecordId": "BA-040",
    "provenance": {
      "sourceTitle": "Repositorio Institucional de Bibliografía Anotada para Pensamiento Transdisciplinario, Educación y Ética de la Inteligencia Artificial V1_1",
      "migrationDate": "2026-10-05",
      "migrationMethod": "controlled_text_extraction"
    },
    "domains": [],
    "keywords": [],
    "annotations": [],
    "relations": [],
    "migrationIssues": []
  },
  {
    "id": "biblio-ba-057",
    "type": "bibliographic_source",
    "title": "On the dangers of stochastic parrots: Can language models be too big? Proceedings of the ACM Conference on Fairness, Accountability, and Transparency",
    "citation": "Bender, E., Gebru, T., McMillan-Major, A., & Mitchell, M. (2021). On the dangers of stochastic parrots: Can language models be too big? Proceedings of the ACM Conference on Fairness, Accountability, and Transparency.",
    "authorsText": "Bender, E., Gebru, T., McMillan-Major, A., & Mitchell, M.",
    "yearText": "2021",
    "owner": "COMMON",
    "profiles": [
      "PH",
      "IT",
      "AT"
    ],
    "maturityStatus": "proposed",
    "verificationStatus": "pending_primary_source",
    "sourceRecordId": "BA-057",
    "provenance": {
      "sourceTitle": "Repositorio Institucional de Bibliografía Anotada para Pensamiento Transdisciplinario, Educación y Ética de la Inteligencia Artificial V1_1",
      "migrationDate": "2026-10-05",
      "migrationMethod": "controlled_text_extraction"
    },
    "domains": [],
    "keywords": [],
    "annotations": [],
    "relations": [],
    "migrationIssues": []
  },
  {
    "id": "biblio-ba-058",
    "type": "bibliographic_source",
    "title": "Algorithmic colonization of Africa",
    "citation": "Birhane, A. (2021). Algorithmic colonization of Africa. SCRIPTed, 18(2), 389–409.",
    "authorsText": "Birhane, A.",
    "yearText": "2021",
    "owner": "COMMON",
    "profiles": [
      "PH",
      "IT",
      "AT"
    ],
    "maturityStatus": "proposed",
    "verificationStatus": "pending_primary_source",
    "sourceRecordId": "BA-058",
    "provenance": {
      "sourceTitle": "Repositorio Institucional de Bibliografía Anotada para Pensamiento Transdisciplinario, Educación y Ética de la Inteligencia Artificial V1_1",
      "migrationDate": "2026-10-05",
      "migrationMethod": "controlled_text_extraction"
    },
    "domains": [],
    "keywords": [],
    "annotations": [],
    "relations": [],
    "migrationIssues": []
  },
  {
    "id": "biblio-ba-030",
    "type": "bibliographic_source",
    "title": "Artificial intelligence in education: A review",
    "citation": "Chen, L., Chen, P., & Lin, Z. (2020). Artificial intelligence in education: A review. Computers & Education.",
    "authorsText": "Chen, L., Chen, P., & Lin, Z.",
    "yearText": "2020",
    "owner": "COMMON",
    "profiles": [
      "PH",
      "IT",
      "AT"
    ],
    "maturityStatus": "proposed",
    "verificationStatus": "pending_primary_source",
    "sourceRecordId": "BA-030",
    "provenance": {
      "sourceTitle": "Repositorio Institucional de Bibliografía Anotada para Pensamiento Transdisciplinario, Educación y Ética de la Inteligencia Artificial V1_1",
      "migrationDate": "2026-10-05",
      "migrationMethod": "controlled_text_extraction"
    },
    "domains": [],
    "keywords": [],
    "annotations": [],
    "relations": [],
    "migrationIssues": []
  },
  {
    "id": "biblio-ba-046",
    "type": "bibliographic_source",
    "title": "Atlas of AI: Power, politics, and the planetary costs of artificial intelligence",
    "citation": "Crawford, K. (2021). Atlas of AI: Power, politics, and the planetary costs of artificial intelligence. Yale University Press.",
    "authorsText": "Crawford, K.",
    "yearText": "2021",
    "owner": "COMMON",
    "profiles": [
      "PH",
      "IT",
      "AT"
    ],
    "maturityStatus": "proposed",
    "verificationStatus": "pending_primary_source",
    "sourceRecordId": "BA-046",
    "provenance": {
      "sourceTitle": "Repositorio Institucional de Bibliografía Anotada para Pensamiento Transdisciplinario, Educación y Ética de la Inteligencia Artificial V1_1",
      "migrationDate": "2026-10-05",
      "migrationMethod": "controlled_text_extraction"
    },
    "domains": [],
    "keywords": [],
    "annotations": [],
    "relations": [],
    "migrationIssues": []
  },
  {
    "id": "biblio-ba-051",
    "type": "bibliographic_source",
    "title": "The global landscape of environmental AI regulation",
    "citation": "Ebert, K., Gamazaychikov, B., Hacker, P., & Luccioni, S. (2026). The global landscape of environmental AI regulation. ACM Conference on Fairness, Accountability, and Transparency.",
    "authorsText": "Ebert, K., Gamazaychikov, B., Hacker, P., & Luccioni, S.",
    "yearText": "2026",
    "owner": "COMMON",
    "profiles": [
      "PH",
      "IT",
      "AT"
    ],
    "maturityStatus": "proposed",
    "verificationStatus": "pending_primary_source",
    "sourceRecordId": "BA-051",
    "provenance": {
      "sourceTitle": "Repositorio Institucional de Bibliografía Anotada para Pensamiento Transdisciplinario, Educación y Ética de la Inteligencia Artificial V1_1",
      "migrationDate": "2026-10-05",
      "migrationMethod": "controlled_text_extraction"
    },
    "domains": [],
    "keywords": [],
    "annotations": [],
    "relations": [],
    "migrationIssues": []
  },
  {
    "id": "biblio-ba-043",
    "type": "bibliographic_source",
    "title": "Ethics guidelines for trustworthy artificial intelligence",
    "citation": "European Commission. (2019). Ethics guidelines for trustworthy artificial intelligence. European Commission.",
    "authorsText": "European Commission.",
    "yearText": "2019",
    "owner": "COMMON",
    "profiles": [
      "PH",
      "IT",
      "AT"
    ],
    "maturityStatus": "proposed",
    "verificationStatus": "pending_primary_source",
    "sourceRecordId": "BA-043",
    "provenance": {